{
  "id": "eval-028-high-08",
  "category": "high_tier",
  "tags": [
    "boundary"
  ],
  "prompt": "Production incident: release is blocked today and login traffic is failing; design the safest rollback path before the next deploy.",
  "expected": {
    "tier": "high",
    "score_min": 0.86,
    "score_max": 0.94,
    "urgency_expected": false,
    "fanout_expected": "none"
  }
}
