{
  "id": "eval-rust-02",
  "category": "high_tier",
  "tags": [
    "stable"
  ],
  "prompt": "Implement SQLite aggregation in Rust using sqlx with async queries and connection pooling.",
  "expected": {
    "tier": "high",
    "score_min": 0.85,
    "score_max": 0.93,
    "urgency_expected": false,
    "fanout_expected": "none"
  }
}
