{
  "id": "evidence-risky-filename-01",
  "category": "medium_tier",
  "tags": [
    "stable",
    "evidence"
  ],
  "prompt": "tidy the helper",
  "seed_files": {
    "credentials.py": "X = 1\n"
  },
  "expected": {
    "tier": "medium",
    "score_min": 0.18,
    "score_max": 0.26,
    "urgency_expected": false,
    "fanout_expected": "favor_parallel"
  }
}
