{
  "id": "eval-028-low-09",
  "category": "low_tier",
  "tags": [
    "stable"
  ],
  "prompt": "Create a one-liner to rename log files by date.",
  "expected": {
    "tier": "low",
    "score_min": 0.0,
    "score_max": 0.04,
    "urgency_expected": false,
    "fanout_expected": "favor_parallel"
  }
}
