{
  "id": "eval-risk-floor-01",
  "category": "medium_tier",
  "tags": [
    "stable",
    "risk-floor"
  ],
  "prompt": "Add a docstring and rename a helper while refactoring the credential keychain storage.",
  "expected": {
    "tier": "medium",
    "score_min": 0.26,
    "score_max": 0.34,
    "urgency_expected": false,
    "fanout_expected": "favor_parallel"
  }
}
