{
  "id": "eval-028-med-07",
  "category": "medium_tier",
  "tags": [
    "stable"
  ],
  "prompt": "Implement middleware for request.py session.py app.py and validate authentication failures in the test suite.",
  "expected": {
    "tier": "medium",
    "score_min": 0.4,
    "score_max": 0.48,
    "urgency_expected": false,
    "fanout_expected": "favor_parallel"
  }
}
