{
  "id": "duration-long-02",
  "category": "duration",
  "tags": [
    "duration",
    "stable"
  ],
  "prompt": "Design a distributed rate limiter with sharded counters",
  "expected": {
    "tier": "high",
    "score_min": 0.86,
    "score_max": 0.94,
    "duration_expected": "medium",
    "file_count_expected": 0
  }
}
