{
  "id": "eval-028-urg-01",
  "category": "urgency",
  "tags": [
    "stable"
  ],
  "prompt": "Production incident today: implement authentication middleware fix for blocked logins.",
  "expected": {
    "tier": "medium",
    "score_min": 0.45,
    "score_max": 0.53,
    "urgency_expected": true,
    "fanout_expected": "favor_parallel"
  }
}
