{
  "id": "prose-scale-verb-02",
  "category": "medium_tier",
  "tags": [
    "stable",
    "prose",
    "scale-verb"
  ],
  "prompt": "Overhaul the retry helper so it backs off instead of hammering.",
  "expected": {
    "tier": "medium",
    "score_min": 0.18,
    "score_max": 0.26,
    "urgency_expected": false,
    "fanout_expected": "favor_parallel",
    "duration_expected": "medium"
  }
}
