{
  "id": "eval-graphics-01",
  "category": "high_tier",
  "tags": [
    "stable"
  ],
  "prompt": "Rewrite the vulkan renderer to use compute shaders and optimize the GPU render pipeline.",
  "expected": {
    "tier": "high",
    "score_min": 0.58,
    "score_max": 0.66,
    "urgency_expected": false,
    "fanout_expected": "none"
  }
}
