{
  "id": "prose-security-sparse-02",
  "category": "medium_tier",
  "tags": [
    "stable",
    "prose",
    "risk-floor"
  ],
  "prompt": "Redact secrets before untrusted page content reaches the log.",
  "expected": {
    "tier": "medium",
    "score_min": 0.06,
    "score_max": 0.14,
    "urgency_expected": false,
    "fanout_expected": "favor_parallel",
    "duration_expected": "short"
  }
}
