{
  "id": "eval-parser-01",
  "category": "high_tier",
  "tags": [
    "stable"
  ],
  "prompt": "Implement a recursive descent parser for a DSL grammar with error recovery and AST codegen.",
  "expected": {
    "tier": "high",
    "score_min": 0.58,
    "score_max": 0.66,
    "urgency_expected": false,
    "fanout_expected": "none"
  }
}
